{
  "schema_version": 2,
  "device_id": "CM-001122334455",
  "boot_epoch": "00000000000000010011223344550000",
  "sample_seq": "1",
  "board_revision": "CARBENTRA-P16-EVT-B",
  "calibrated": false,
  "valid": false,
  "monotonic_ms": 5000,
  "measurement_monotonic_ms": 5000,
  "time_quality": "unknown",
  "unix_s": null,
  "unix_lower_s": null,
  "unix_upper_s": null,
  "fault_latched": false,
  "board_temperature_valid": false,
  "desired_on": false,
  "feedback_valid": true,
  "output_present": false,
  "output_sensing": "NO_AC_PULSES_DETECTED",
  "voltage_absence_proven": false,
  "ram_buffer_dropped": 0,
  "command_dropped": 0,
  "energy_status": "uncalibrated_no_energy_result",
  "known_forward_wh_since_boot": 0,
  "known_reverse_wh_since_boot": 0,
  "energy_uncertain_intervals": 5
}
